commit	gen_speed	accuracy	status	description
c7d238e	0.0000	0.0000	keep	initial port scaffolding (empty stubs for reference/ and tt/)
f718b74	0.1985	99.9959	keep	CPU passthrough baseline (B=1 S=1 518x518, torch ref, PCC 1.0 self)
f718b74	0.1416	99.9967	discard	torch.set_num_threads(16) — slower (5037→7064ms, HT oversubscription on 16-core host)
185868f	0.3203	99.4818	keep	ttnn MLP port — all 72 Mlp fc1+gelu+fc2 on device (5037→3122 ms, 0.20→0.32 fps)
185868f	0.2898	98.5907	discard	port ALL nn.Linear — PCC 0.986 (<0.99) and slower (tiny head linears: overhead + precision loss)
185868f	0.4028	98.8353	discard	MLP + attn qkv/proj — PCC 0.988 (<0.99) on world_points_conf (bf16 precision)
b311533	0.3746	99.2989	keep	attention qkv on ttnn (proj stays CPU) — 3122→2669 ms (+17% over MLP, +89% vs baseline)
b311533	0.3608	99.4441	discard	port Block.norm1/norm2 LayerNorms — +100 ms (host<->device overhead exceeds LN compute)
0a04e6fdd8	0.4008	99.5524	keep	attn proj on ttnn with HiFi4+fp32 dest - 2669->2495 ms (+7 pct), PCC 0.9955 (HiFi4 restored precision)
0a04e6f	0.4272	0.0000	discard	autocast bf16 over entire VGGT forward — world_points_conf PCC 0.0 (heads need fp32 tokens)
0a04e6f	0.3898	99.5207	discard	aggregator bf16 autocast + fp32 cast-back of tokens list — +70 ms (list cast eats the win)
0a04e6f	0.4341	97.9368	discard	SDPA on device LoFi — 0.979 (<0.99)
0a04e6f	0.4932	57.2424	discard	SDPA on device HiFi4 — 0.572 world_points_conf collapse (ttnn SDPA shape-sensitive)
0a04e6f	0.3948	99.3596	discard	fuse Block.norm2 into MLP on device — +37 ms (device LN overhead no win vs CPU LN + single upload)
0a04e6f	0.4615	97.8848	discard	manual Q@K^T softmax Q@V on device HiFi4 — PCC 0.979 (bf16 softmax precision)
0a04e6f	0.4017	99.5100	discard	fp32 manual attention on device — break-even (2489 vs 2495 ms), adds complexity (simplicity criterion)
0a04e6f	0.3909	99.5524	discard	skip ttnn when N<64 (camera_head trunk seq=5) — +60 ms or noise, no clear win
53d46c195c	0.4481	99.4325	keep	full attention on device (bf16 upload, fp32 scores+softmax) - 2495->2232 ms (+12 pct), PCC 0.9943
53d46c1	0.4481	99.4325	discard	nlp_create_qkv_heads split (V stays on device) — no change (reshape+split overhead washes v-upload saving)
9c7d71a356	0.4559	99.5525	keep	fuse Block.norm1 into attention (LN+qkv on device, norm1=Identity) - 2232->2193 ms (+2 pct), PCC 0.9955
9c7d71a	0.4571	99.3598	discard	fuse Block.norm2 into MLP — 6 ms noise-level gain, 0.9955->0.9936 PCC (simplicity)
a86d4aab4e	0.4837	99.4588	keep	keep qkv in bf16 through CPU ops - 2193->2067 ms (+6 pct, +144 pct vs baseline)
a86d4aa	0.4119	99.4595	discard	torch threads=4 — slower (2428 ms vs 2126 ms default 8); CPU LN/rope/reshape benefit from more threads
ffd157c	0.5393	0.0000	discard	bf16 autocast over DPTHead.forward — PCC 0 (conf expp1 activation too precision-sensitive)
ffd157c	0.4691	99.4570	discard	DPT norm+projects (1x1 conv as linear) on device — 2080->2131 ms (overhead=savings: prelude only 54ms CPU)
a7106b1898	0.5391	99.4009	keep	bf16 autocast on DPT conv stack (fp32 cast-back before activate) - 2126->1855 ms (+14 pct, +172 pct vs baseline)
41412cfd75	0.5416	99.4000	keep	bf16 autocast on CameraHead (fp32 cast-back) - small win, consistent pattern with DPT
6f42f75019	0.5560	99.1599	keep	top-level bf16 autocast (heads cast fp32 before activation) - 1855->1798 ms (+3 pct, +180 pct vs baseline)
8969cef22e	0.5841	99.6143	keep	full on-device Block (only RoPE on CPU) - 2080->1712 ms (+22 pct, +194 pct vs baseline), PCC 0.9961
bae1d6059e	0.6097	99.5700	keep	2D RoPE on device (cos/sin tables precomputed, apply via slice+rotate+mul+add) - 1712->1640 ms (+207 pct vs baseline)
db0ff6a28c	0.6104	99.5900	keep	DPT output_conv2 (3x3+relu+1x1 at 518x518) on ttnn.conv2d - break-even speed, moves ~454 ms of CPU work to device
db0ff6a	0.5276	99.6000	discard	per-conv wrapper for DPT scratch — 1640->1895 ms (per-conv up/down roundtrip x 120 calls eats compute)
2b2bf2d	0.7053	-7.5400	discard	device-native scratch_forward — PCC broken (-0.08); layout/add mismatch between conv2d chained outputs; needs careful mast3r-style layout debugging
5d6d729	2.6954	99.3500	keep	TT_FUSED=1 device-resident TtVggt + one metal trace per S (B1/B2/B3/B4/B5/B7/B13) after the first p150a fixes (rotary padded-row shape, interp/gather batch-broadcast hang) - 1322->371 ms eager S=1, PCC 0.9935 (legacy 0.9950 on this tree)
f37f89f	2.6954	99.3500	keep	DPT heads per frame (batched 518^2 conv needs DRAM op-slicing at S>=2: not trace-capturable, hung the chip eagerly with a live trace); VGGT_L1_SMALL_KB; 4 traces live S=1..4 - S=2 803 ms (legacy 2314), S=4 2618 (5748)
0690ca1	2.2321	99.5200	keep	VGGT_FUSED_INTERP=exact: 0/1 bf16 gathers of a bf16 hi/lo split + fp32 eltwise weights (the fp32 x fp32 matmul rounds tf32-class) - S=1 448 ms, PCC 0.9952 = host fp32 interpolation; rep 371 ms / 0.9935 kept as opt-in
0690ca1	3.1250	99.7900	discard	VGGT_FUSED_ATTN=sdpa (B10) - S=1 243 ms / 0.9957, S=4 980 ms / 0.9973 synthetic, but 7-scene real-image set 0.99793 mean (legacy 0.99903; depth_conf -0.0027 on the KITTI S=3 scene) - knob only
0690ca1	2.6882	99.8400	discard	VGGT_FUSED_MATMUL=minimal (B8) - S=1 372 ms (no gain), PCC 0.9984 synthetic, real-image set +-0.0001 vs default - knob only
0690ca1	1.7133	99.5200	discard	VGGT_FUSED_CAMERA=host - 584 ms (readback + torch camera head), pose_enc identical - device camera head kept
f37f89f	0.0000	99.8700	discard	VGGT_FUSED_SOFTMAX=inplace/scale_mask at S=3 (B11): no hang at N=4122, PCC 0.9987, 1553 ms eager vs 1719 traced default - superseded by SDPA for speed, kept as knobs
f37f89f	2.6882	99.3700	discard	VGGT_FUSED_LN32=eltwise (fp32 eltwise LayerNorm for the DINOv2 output; the fp32 layer_norm kernel is bf16-class) - +0.0002 PCC, +1 ms - opt-in
f37f89f	2.6738	99.1600	discard	VGGT_FUSED_PRELUDE=fp32 (fp32 DPT prelude) - PCC 0.9916 (worse than bf16 0.9935)
2c31bd3	2.4631	99.5200	keep	VGGT_FUSED_RESHAPE=rm: upsample relayouts as untilize -> RM view -> tilize (6-7 ms -> 1.5 ms each at 518^2), bit-identical - S=1 448->406 ms, S=2 953->874, S=4 2909->2759
3b98d5c	2.4631	99.5200	keep	TT_FUSED default ON (TT_FUSED=0 = legacy path); served in the shipped image: S=1 forward 411 ms median (legacy 1602), S=2 881 (2887), smoke PASS, clean stop
